{
    "id": "race_dwarf",
    "name": "Dwarf",
    "traits": [
        "trait_dwarf_ability_bonuses",
        "trait_dwarf_age",
        "trait_dwarf_size",
        "trait_dwarf_speed",
        "trait_dwarf_speed_resilience",
        "trait_dwarven_resilience",
        "trait_darkvision_60",
        "trait_dwarven_combat_training",
        "trait_dwarf_tool_proficiency",
        "trait_stonecutting",
        "trait_dwarf_languages"
    ],
    "subraceInfo": {
        "displayLabel": "Subrace"
    },
    "lore": {
        "shortDescription": "Mountain-dwelling craftspeople of ancient strongholds, bound by fierce clan loyalty and a long memory for both tradition and grudges.",
        "fullText": "Kingdoms rich in ancient grandeur, halls carved into the roots of mountains, the echoing of picks and hammers in deep mines and blazing forges, a commitment to clan and tradition, and a burning hatred of goblins and ores-these common threads unite all dwarves.",
        "sections": [
            {
                "title": "Short And Stout",
                "body": "Bold and hardy, dwarves are known as skilled warriors, miners, and workers of stone and metal. Though they stand well under 5 feel tall, dwarves are so broad and compact that they can weigh as much as a human standing nearly two feet taller. Their courage and endurance are also easily a match for any of the larger folk.\nDwarven skin ranges from deep brown to a paler hue tinged with red, but the most common shades are light brown or deep tan, like certain tones of earth. Their hair, worn long but in simple styles, is usually black, gray, or brown, though paler dwarves often have red hair. Male dwarves value their beards highly and groom them carefully."
            },
            {
                "title": "Long Memory, Long Grudges",
                "body": "Dwarves can live to be more than 400 years old, so lhe oldest living dwarves often remember a very different world. For example, some of the oldest dwarves living in Citadel Felbarr (in the world of the Forgotten Realms) can recall the day, more than three centuries ago, when orcs conquered the fortress and drove them into an exile that lasted over 250 years. This longevity grants them a perspective on lhe world that shorter-lived races such as humans and halflings lack.\nDwarves are solid and enduring like the mountains they love, weathering the passage of centuries with stoic endurance and little change. They respect the traditions of their clans, tracing their ancestry back to the founding of their most ancient strongholds in the youth of the world, and don't abandon those traditions lightly. Part of those traditions is devotion to the gods of the dwarves, who uphold the dwarven ideals of industrious labor, skill in battle, and devotion to the forge.\nIndividual dwarves are determined and loyal, true to their word and decisive in action, sometimes to the point of stubbornness. Many dwarves have a strong sense of justice, and they are slow to forget wrongs they have suffered. A wrong done to one dwarf is a wrong done to the dwarf's entire clan, so what begins as one dwarf's hunt for vengeance can become a full-blown clan feud."
            }
        ]
    }
}