{
    "id": "race_dragonborn",
    "name": "Dragonborn",
    "traits": [
        "trait_dragonborn_ability_bonuses",
        "trait_dragonborn_age",
        "trait_dragonborn_size",
        "trait_dragonborn_speed",
        "trait_dragonborn_languages"
    ],
    "subraceInfo": {
        "displayLabel": "Draconic Ancestry"
    },
    "lore": {
        "shortDescription": "Humanoids descended from dragons, bearing draconic heritage and power. Some serve as faithful dragon warriors, while others find their own path.",
        "fullText": "Born of dragons, as their name proclaims, the dragonborn walk proudly through a world that greets them with fearful incomprehension. Shaped by draconic gods or the dragons themselves, dragonborn originally hatched from dragon eggs as a unique race, combining the best attributes of dragons and humanoids. Some dragonborn are faithful servants to true dragons, others form the ranks of soldiers in great wars, and still others find themselves adrift, with no clear calling in life.",
        "sections": [
            {
                "title": "Proud Dragon Kin",
                "body": ""
            },
            {
                "title": "Self-Sufficient Clans",
                "body": ""
            },
            {
                "title": "Dragonborn Names",
                "body": ""
            },
            {
                "title": "",
                "body": ""
            }
        ]
    }
}