{
    "id": "race_elf",
    "name": "Elf",
    "traits": [
        "trait_elf_ability_bonuses",
        "trait_elf_age",
        "trait_elf_size",
        "trait_elf_speed",
        "trait_darkvision_60",
        "trait_keen_senses",
        "trait_fey_ancestry",
        "trait_trance",
        "trait_elf_languages"
    ],
    "subraceInfo": {
        "optionsPool": "subraces_elf"
    },
    "lore": {
        "shortDescription": "Graceful, magical beings with an otherworldly nature, devoted to beauty, art, and the wonders of the natural world.",
        "fullText": "Elves are a magical people of otherworldly grace, living in the world but not entirely part of it. They live in places of ethereal beauty, in the midst of ancient forests ar in silvery spires glittering with faerie light, where soft music drifts through the air and gentle fragrances waft on the breeze. Elves love nature and magic, art and artistry, music and poetry, and the good things of the world."
    }
}